{
  "schema_version": 1,
  "project": {
    "name": "Synthetic 10",
    "root": ".",
    "frameworks": [
      "synthetic"
    ]
  },
  "endpoints": [
    {
      "id": "ep-f8a3ba70a96b08ea",
      "method": "PUT",
      "path": "/admin/action-02",
      "display_path": "/admin/action-02",
      "district": "ADMIN",
      "framework": "synthetic",
      "operation_id": "operation2",
      "tags": [
        "admin"
      ],
      "sources": [
        {
          "file": "src/routes/admin.ts",
          "line": 3,
          "column": 1
        }
      ],
      "contract": {
        "confidence": "exact",
        "request": {
          "bodies": [
            {
              "media_type": "application/json",
              "schema_id": "schema-10a5cae1d523b3fa",
              "required": true
            }
          ]
        },
        "responses": [
          {
            "status": "200",
            "contents": [
              {
                "media_type": "application/json",
                "schema_id": "schema-dbb52d0e919fc26f"
              }
            ]
          },
          {
            "status": "400",
            "contents": [
              {
                "media_type": "application/json",
                "schema_id": "schema-f549feac7b59ad70"
              }
            ]
          }
        ],
        "evidence": [
          {
            "kind": "open-api",
            "detail": "Synthetic OpenAPI request and response contract",
            "source": {
              "file": "src/routes/admin.ts",
              "line": 3,
              "column": 1
            }
          }
        ]
      }
    },
    {
      "id": "ep-bea2b28cf01c0231",
      "method": "PATCH",
      "path": "/admin/action-08",
      "display_path": "/admin/action-08",
      "district": "ADMIN",
      "framework": "synthetic",
      "operation_id": "operation8",
      "tags": [
        "admin"
      ],
      "sources": [
        {
          "file": "src/routes/admin.ts",
          "line": 9,
          "column": 1
        }
      ],
      "contract": {
        "confidence": "exact",
        "request": {
          "bodies": [
            {
              "media_type": "application/json",
              "schema_id": "schema-10a5cae1d523b3fa",
              "required": true
            }
          ]
        },
        "responses": [
          {
            "status": "200",
            "contents": [
              {
                "media_type": "application/json",
                "schema_id": "schema-dbb52d0e919fc26f"
              }
            ]
          },
          {
            "status": "400",
            "contents": [
              {
                "media_type": "application/json",
                "schema_id": "schema-f549feac7b59ad70"
              }
            ]
          }
        ],
        "evidence": [
          {
            "kind": "open-api",
            "detail": "Synthetic OpenAPI request and response contract",
            "source": {
              "file": "src/routes/admin.ts",
              "line": 9,
              "column": 1
            }
          }
        ]
      }
    },
    {
      "id": "ep-834d8bded2d2873c",
      "method": "DELETE",
      "path": "/billing/action-04",
      "display_path": "/billing/action-04",
      "district": "BILLING",
      "framework": "synthetic",
      "operation_id": "operation4",
      "tags": [
        "billing"
      ],
      "sources": [
        {
          "file": "src/routes/billing.ts",
          "line": 5,
          "column": 1
        }
      ],
      "contract": {
        "confidence": "exact",
        "responses": [
          {
            "status": "200",
            "contents": [
              {
                "media_type": "application/json",
                "schema_id": "schema-dbb52d0e919fc26f"
              }
            ]
          },
          {
            "status": "400",
            "contents": [
              {
                "media_type": "application/json",
                "schema_id": "schema-f549feac7b59ad70"
              }
            ]
          }
        ],
        "evidence": [
          {
            "kind": "open-api",
            "detail": "Synthetic OpenAPI request and response contract",
            "source": {
              "file": "src/routes/billing.ts",
              "line": 5,
              "column": 1
            }
          }
        ]
      }
    },
    {
      "id": "ep-c786d5a5c228f0ea",
      "method": "GET",
      "path": "/events/action-05",
      "display_path": "/events/action-05",
      "district": "EVENTS",
      "framework": "synthetic",
      "operation_id": "operation5",
      "tags": [
        "events"
      ],
      "sources": [
        {
          "file": "src/routes/events.ts",
          "line": 6,
          "column": 1
        }
      ],
      "contract": {
        "confidence": "exact",
        "responses": [
          {
            "status": "200",
            "contents": [
              {
                "media_type": "application/json",
                "schema_id": "schema-dbb52d0e919fc26f"
              }
            ]
          },
          {
            "status": "400",
            "contents": [
              {
                "media_type": "application/json",
                "schema_id": "schema-f549feac7b59ad70"
              }
            ]
          }
        ],
        "evidence": [
          {
            "kind": "open-api",
            "detail": "Synthetic OpenAPI request and response contract",
            "source": {
              "file": "src/routes/events.ts",
              "line": 6,
              "column": 1
            }
          }
        ]
      }
    },
    {
      "id": "ep-eb33c83b205d2d8f",
      "method": "GET",
      "path": "/orders",
      "display_path": "/orders",
      "district": "ORDERS",
      "framework": "synthetic",
      "operation_id": "operation1",
      "tags": [
        "orders"
      ],
      "sources": [
        {
          "file": "src/routes/orders.ts",
          "line": 2,
          "column": 1
        }
      ],
      "contract": {
        "confidence": "exact",
        "responses": [
          {
            "status": "200",
            "contents": [
              {
                "media_type": "application/json",
                "schema_id": "schema-f49dabc17276d594"
              }
            ]
          },
          {
            "status": "400",
            "contents": [
              {
                "media_type": "application/json",
                "schema_id": "schema-f549feac7b59ad70"
              }
            ]
          }
        ],
        "evidence": [
          {
            "kind": "open-api",
            "detail": "Synthetic OpenAPI request and response contract",
            "source": {
              "file": "src/routes/orders.ts",
              "line": 2,
              "column": 1
            }
          }
        ]
      }
    },
    {
      "id": "ep-37402d6d850a79b0",
      "method": "PUT",
      "path": "/orders/{id}",
      "display_path": "/orders/{id}",
      "district": "ORDERS",
      "framework": "synthetic",
      "operation_id": "operation7",
      "tags": [
        "orders"
      ],
      "sources": [
        {
          "file": "src/routes/orders.ts",
          "line": 8,
          "column": 1
        }
      ],
      "contract": {
        "confidence": "exact",
        "request": {
          "parameters": [
            {
              "name": "id",
              "location": "path",
              "required": true,
              "schema_id": "schema-b0db8bff287580b9"
            }
          ],
          "bodies": [
            {
              "media_type": "application/json",
              "schema_id": "schema-10a5cae1d523b3fa",
              "required": true
            }
          ]
        },
        "responses": [
          {
            "status": "200",
            "contents": [
              {
                "media_type": "application/json",
                "schema_id": "schema-dbb52d0e919fc26f"
              }
            ]
          },
          {
            "status": "400",
            "contents": [
              {
                "media_type": "application/json",
                "schema_id": "schema-f549feac7b59ad70"
              }
            ]
          }
        ],
        "evidence": [
          {
            "kind": "open-api",
            "detail": "Synthetic OpenAPI request and response contract",
            "source": {
              "file": "src/routes/orders.ts",
              "line": 8,
              "column": 1
            }
          }
        ]
      }
    },
    {
      "id": "ep-ee8e6086d1a60837",
      "method": "PATCH",
      "path": "/reports/item-03/{id}",
      "display_path": "/reports/item-03/{id}",
      "district": "REPORTS",
      "framework": "synthetic",
      "operation_id": "operation3",
      "tags": [
        "reports"
      ],
      "sources": [
        {
          "file": "src/routes/reports.ts",
          "line": 4,
          "column": 1
        }
      ],
      "contract": {
        "confidence": "exact",
        "request": {
          "parameters": [
            {
              "name": "id",
              "location": "path",
              "required": true,
              "schema_id": "schema-b0db8bff287580b9"
            }
          ],
          "bodies": [
            {
              "media_type": "application/json",
              "schema_id": "schema-10a5cae1d523b3fa",
              "required": true
            }
          ]
        },
        "responses": [
          {
            "status": "200",
            "contents": [
              {
                "media_type": "application/json",
                "schema_id": "schema-dbb52d0e919fc26f"
              }
            ]
          },
          {
            "status": "400",
            "contents": [
              {
                "media_type": "application/json",
                "schema_id": "schema-f549feac7b59ad70"